Date,Description,Withdrawals ($),Deposits ($),Total Balance
5/2/2026,INTERAC PURCHASE SOBEYS #3421,95.80,,9071.10
5/5/2026,INTERAC PURCHASE SHOPPERS DRUG MART,18.40,,9052.70
5/7/2026,BILL PAYMENT ROGERS WIRELESS,95.00,,8957.70
5/9/2026,INTERAC PURCHASE CANADIAN TIRE,38.50,,8919.20
5/12/2026,PAYROLL - EMPLOYER,,2800.00,11719.20
5/14/2026,INTERAC e-TRANSFER SENT TO MOM,200.00,,11519.20
5/16/2026,INTERAC PURCHASE ESSO GAS BAR,61.20,,11458.00
5/18/2026,INTERAC PURCHASE PIZZA PIZZA,21.40,,11436.60
5/20/2026,BILL PAYMENT HYDRO ONE,88.00,,11348.60
